{
  "schema_version": "1.0",
  "component": "DSG.EquipmentPerformanceRegistry.F5.CollectionReadModel",
  "authority": "projection",
  "action_authority": "NONE",
  "source_contract": {
    "f3_projection": "docs/data/equipment-performance-registry-f3-multisession.json",
    "f5_contract": "docs/architecture/telemetry/BKL-039-F5-Dynamic-Multi-Session-Equipment-Performance-Registry-Contract.md"
  },
  "population_count": 10,
  "views": [
    {
      "population_id": "EPR-F5-UVVBVFRSTzIwMF9UT1VQVEVLMjk0X0JJTjF8MjAyNi0wNy0xNF8yMDI2LTA3LTE1fExETiAxMzIwfExQUk98TElHSFR8RldITQ",
      "configuration_id": "QUATTRO200_TOUPTEK294_BIN1",
      "session_id": "2026-07-14_2026-07-15",
      "target_name": "LDN 1320",
      "filter_name": "LPRO",
      "frame_type": "LIGHT",
      "metric_name": "FWHM",
      "measurement_count": 19,
      "coverage": "COMPLETE_FOR_DECLARED_POPULATION",
      "unit": "NINA_FILENAME_FWHM_SOURCE_UNIT",
      "unit_semantics": "SOURCE_NATIVE_UNCALIBRATED",
      "angular_calibration_state": "NOT_PROVEN",
      "measurement_method_id": "BKL039-F3-FWHM-NINA-FILENAME-EXTRACT-V1",
      "authority": "projection",
      "action_authority": "NONE",
      "source_record_refs": [
        "data/analytics/history/target-exposures.csv#2026-07-14_2026-07-15:line=1762",
        "data/analytics/history/target-exposures.csv#2026-07-14_2026-07-15:line=1837",
        "data/analytics/history/target-exposures.csv#2026-07-14_2026-07-15:line=1862",
        "data/analytics/history/target-exposures.csv#2026-07-14_2026-07-15:line=1883",
        "data/analytics/history/target-exposures.csv#2026-07-14_2026-07-15:line=1992",
        "data/analytics/history/target-exposures.csv#2026-07-14_2026-07-15:line=2060",
        "data/analytics/history/target-exposures.csv#2026-07-14_2026-07-15:line=2124",
        "data/analytics/history/target-exposures.csv#2026-07-14_2026-07-15:line=2189",
        "data/analytics/history/target-exposures.csv#2026-07-14_2026-07-15:line=2259",
        "data/analytics/history/target-exposures.csv#2026-07-14_2026-07-15:line=2324",
        "data/analytics/history/target-exposures.csv#2026-07-14_2026-07-15:line=2389",
        "data/analytics/history/target-exposures.csv#2026-07-14_2026-07-15:line=2458",
        "data/analytics/history/target-exposures.csv#2026-07-14_2026-07-15:line=2534",
        "data/analytics/history/target-exposures.csv#2026-07-14_2026-07-15:line=2586",
        "data/analytics/history/target-exposures.csv#2026-07-14_2026-07-15:line=2656",
        "data/analytics/history/target-exposures.csv#2026-07-14_2026-07-15:line=2720",
        "data/analytics/history/target-exposures.csv#2026-07-14_2026-07-15:line=2784",
        "data/analytics/history/target-exposures.csv#2026-07-14_2026-07-15:line=2853",
        "data/analytics/history/target-exposures.csv#2026-07-14_2026-07-15:line=2935"
      ],
      "citation_refs": [
        "data/analytics/history/target-exposures.csv",
        "data/analytics/history/target-summary.csv",
        "data/analytics/metadata/session-scientific-metadata.csv"
      ],
      "provenance_refs": [
        "docs/architecture/telemetry/BKL-039-F5-Dynamic-Multi-Session-Equipment-Performance-Registry-Contract.md",
        "data/sessions/2026/07/2026-07-14_2026-07-15/raw/nina/20260713-154938-3.2.0.9001.4940-202607.log"
      ],
      "measurements": [
        {
          "record_id": "EPR-F5-UVVBVFRSTzIwMF9UT1VQVEVLMjk0X0JJTjF8MjAyNi0wNy0xNF8yMDI2LTA3LTE1fExETiAxMzIwfExQUk98TElHSFR8RldITQ-M-0000",
          "sequence_number": "0000",
          "timestamp": "2026-07-15T00:22:34.244900+02:00",
          "value": 8.45,
          "source_record_ref": "data/analytics/history/target-exposures.csv#2026-07-14_2026-07-15:line=1762"
        },
        {
          "record_id": "EPR-F5-UVVBVFRSTzIwMF9UT1VQVEVLMjk0X0JJTjF8MjAyNi0wNy0xNF8yMDI2LTA3LTE1fExETiAxMzIwfExQUk98TElHSFR8RldITQ-M-0001",
          "sequence_number": "0001",
          "timestamp": "2026-07-15T00:35:16.296100+02:00",
          "value": 7.7,
          "source_record_ref": "data/analytics/history/target-exposures.csv#2026-07-14_2026-07-15:line=1837"
        },
        {
          "record_id": "EPR-F5-UVVBVFRSTzIwMF9UT1VQVEVLMjk0X0JJTjF8MjAyNi0wNy0xNF8yMDI2LTA3LTE1fExETiAxMzIwfExQUk98TElHSFR8RldITQ-M-0002",
          "sequence_number": "0002",
          "timestamp": "2026-07-15T00:45:38.274900+02:00",
          "value": 7.77,
          "source_record_ref": "data/analytics/history/target-exposures.csv#2026-07-14_2026-07-15:line=1862"
        },
        {
          "record_id": "EPR-F5-UVVBVFRSTzIwMF9UT1VQVEVLMjk0X0JJTjF8MjAyNi0wNy0xNF8yMDI2LTA3LTE1fExETiAxMzIwfExQUk98TElHSFR8RldITQ-M-0003",
          "sequence_number": "0003",
          "timestamp": "2026-07-15T00:55:54.053200+02:00",
          "value": 8.21,
          "source_record_ref": "data/analytics/history/target-exposures.csv#2026-07-14_2026-07-15:line=1883"
        },
        {
          "record_id": "EPR-F5-UVVBVFRSTzIwMF9UT1VQVEVLMjk0X0JJTjF8MjAyNi0wNy0xNF8yMDI2LTA3LTE1fExETiAxMzIwfExQUk98TElHSFR8RldITQ-M-0004",
          "sequence_number": "0004",
          "timestamp": "2026-07-15T01:12:31.221100+02:00",
          "value": 7.29,
          "source_record_ref": "data/analytics/history/target-exposures.csv#2026-07-14_2026-07-15:line=1992"
        },
        {
          "record_id": "EPR-F5-UVVBVFRSTzIwMF9UT1VQVEVLMjk0X0JJTjF8MjAyNi0wNy0xNF8yMDI2LTA3LTE1fExETiAxMzIwfExQUk98TElHSFR8RldITQ-M-0005",
          "sequence_number": "0005",
          "timestamp": "2026-07-15T01:25:50.617800+02:00",
          "value": 7.52,
          "source_record_ref": "data/analytics/history/target-exposures.csv#2026-07-14_2026-07-15:line=2060"
        },
        {
          "record_id": "EPR-F5-UVVBVFRSTzIwMF9UT1VQVEVLMjk0X0JJTjF8MjAyNi0wNy0xNF8yMDI2LTA3LTE1fExETiAxMzIwfExQUk98TElHSFR8RldITQ-M-0006",
          "sequence_number": "0006",
          "timestamp": "2026-07-15T01:39:07.929100+02:00",
          "value": 7.79,
          "source_record_ref": "data/analytics/history/target-exposures.csv#2026-07-14_2026-07-15:line=2124"
        },
        {
          "record_id": "EPR-F5-UVVBVFRSTzIwMF9UT1VQVEVLMjk0X0JJTjF8MjAyNi0wNy0xNF8yMDI2LTA3LTE1fExETiAxMzIwfExQUk98TElHSFR8RldITQ-M-0007",
          "sequence_number": "0007",
          "timestamp": "2026-07-15T01:52:35.844200+02:00",
          "value": 7.85,
          "source_record_ref": "data/analytics/history/target-exposures.csv#2026-07-14_2026-07-15:line=2189"
        },
        {
          "record_id": "EPR-F5-UVVBVFRSTzIwMF9UT1VQVEVLMjk0X0JJTjF8MjAyNi0wNy0xNF8yMDI2LTA3LTE1fExETiAxMzIwfExQUk98TElHSFR8RldITQ-M-0008",
          "sequence_number": "0008",
          "timestamp": "2026-07-15T02:06:17.121600+02:00",
          "value": 9.05,
          "source_record_ref": "data/analytics/history/target-exposures.csv#2026-07-14_2026-07-15:line=2259"
        },
        {
          "record_id": "EPR-F5-UVVBVFRSTzIwMF9UT1VQVEVLMjk0X0JJTjF8MjAyNi0wNy0xNF8yMDI2LTA3LTE1fExETiAxMzIwfExQUk98TElHSFR8RldITQ-M-0009",
          "sequence_number": "0009",
          "timestamp": "2026-07-15T02:20:05.070200+02:00",
          "value": 8.22,
          "source_record_ref": "data/analytics/history/target-exposures.csv#2026-07-14_2026-07-15:line=2324"
        },
        {
          "record_id": "EPR-F5-UVVBVFRSTzIwMF9UT1VQVEVLMjk0X0JJTjF8MjAyNi0wNy0xNF8yMDI2LTA3LTE1fExETiAxMzIwfExQUk98TElHSFR8RldITQ-M-0010",
          "sequence_number": "0010",
          "timestamp": "2026-07-15T02:33:52.010100+02:00",
          "value": 7.24,
          "source_record_ref": "data/analytics/history/target-exposures.csv#2026-07-14_2026-07-15:line=2389"
        },
        {
          "record_id": "EPR-F5-UVVBVFRSTzIwMF9UT1VQVEVLMjk0X0JJTjF8MjAyNi0wNy0xNF8yMDI2LTA3LTE1fExETiAxMzIwfExQUk98TElHSFR8RldITQ-M-0011",
          "sequence_number": "0011",
          "timestamp": "2026-07-15T02:47:26.773800+02:00",
          "value": 6.96,
          "source_record_ref": "data/analytics/history/target-exposures.csv#2026-07-14_2026-07-15:line=2458"
        },
        {
          "record_id": "EPR-F5-UVVBVFRSTzIwMF9UT1VQVEVLMjk0X0JJTjF8MjAyNi0wNy0xNF8yMDI2LTA3LTE1fExETiAxMzIwfExQUk98TElHSFR8RldITQ-M-0012",
          "sequence_number": "0012",
          "timestamp": "2026-07-15T03:00:56.810500+02:00",
          "value": 7.45,
          "source_record_ref": "data/analytics/history/target-exposures.csv#2026-07-14_2026-07-15:line=2534"
        },
        {
          "record_id": "EPR-F5-UVVBVFRSTzIwMF9UT1VQVEVLMjk0X0JJTjF8MjAyNi0wNy0xNF8yMDI2LTA3LTE1fExETiAxMzIwfExQUk98TElHSFR8RldITQ-M-0013",
          "sequence_number": "0013",
          "timestamp": "2026-07-15T03:14:08.856100+02:00",
          "value": 7.63,
          "source_record_ref": "data/analytics/history/target-exposures.csv#2026-07-14_2026-07-15:line=2586"
        },
        {
          "record_id": "EPR-F5-UVVBVFRSTzIwMF9UT1VQVEVLMjk0X0JJTjF8MjAyNi0wNy0xNF8yMDI2LTA3LTE1fExETiAxMzIwfExQUk98TElHSFR8RldITQ-M-0014",
          "sequence_number": "0014",
          "timestamp": "2026-07-15T03:27:35.869500+02:00",
          "value": 7.21,
          "source_record_ref": "data/analytics/history/target-exposures.csv#2026-07-14_2026-07-15:line=2656"
        },
        {
          "record_id": "EPR-F5-UVVBVFRSTzIwMF9UT1VQVEVLMjk0X0JJTjF8MjAyNi0wNy0xNF8yMDI2LTA3LTE1fExETiAxMzIwfExQUk98TElHSFR8RldITQ-M-0015",
          "sequence_number": "0015",
          "timestamp": "2026-07-15T03:40:57.397200+02:00",
          "value": 7.15,
          "source_record_ref": "data/analytics/history/target-exposures.csv#2026-07-14_2026-07-15:line=2720"
        },
        {
          "record_id": "EPR-F5-UVVBVFRSTzIwMF9UT1VQVEVLMjk0X0JJTjF8MjAyNi0wNy0xNF8yMDI2LTA3LTE1fExETiAxMzIwfExQUk98TElHSFR8RldITQ-M-0016",
          "sequence_number": "0016",
          "timestamp": "2026-07-15T03:54:12.578800+02:00",
          "value": 7.04,
          "source_record_ref": "data/analytics/history/target-exposures.csv#2026-07-14_2026-07-15:line=2784"
        },
        {